[
  {
    "id": "laboratory-ph-meter",
    "pdfNumber": 61,
    "pdfName": "Laboratory pH Meter",
    "pdfMainUse": "Measuring solution pH using an electrode",
    "pdfGroup": "pH measurement instruments",
    "name": "Laboratory pH Meter",
    "category": "pH and Analytical Instruments",
    "purpose": "Measures solution pH with high analytical precision using a potentiometric glass combination electrode at a fixed bench station.",
    "image": {
      "src": "assets/images/equipment/laboratory-ph-meter.svg",
      "alt": "Benchtop laboratory pH meter with digital touchscreen display, articulated electrode stand, and combination glass pH electrode",
      "credit": "Laboratory Standard Vector Assets",
      "status": "fallback"
    },
    "ar": {
      "modelFile": "assets/models/laboratory-ph-meter.glb",
      "modelStatus": "missing",
      "interactions": [
        "tap-to-label",
        "rotate",
        "zoom",
        "reveal usage steps"
      ]
    },
    "description": "A high-precision benchtop potentiometric voltmeter connected to a glass combination electrode and an automatic temperature compensation (ATC) probe. Measures the electrical potential difference across a thin glass membrane relative to an internal silver/silver-chloride reference electrode, calculating hydronium ion activity based on the Nernst equation.",
    "alternativeNames": [
      "Benchtop pH meter",
      "Analytical pH meter",
      "Glass electrode pH meter",
      "Potentiometric pH meter"
    ],
    "commonUses": [
      "High-precision pH determination of chemical buffers, media, and synthesis mixtures (0.01 to 0.001 pH resolution)",
      "Potentiometric acid-base titrations to locate exact equivalence points and pKa values",
      "Quality control monitoring in pharmaceutical, food science, and chemical manufacturing",
      "Regulatory compliance testing of laboratory wastewater discharge"
    ],
    "types": [
      "Research-grade benchtop pH meter (touchscreen display, up to 5-point calibration, GLP compliance logging)",
      "Standard routine laboratory bench pH meter (push-button 2-to-3 point calibration, ±0.01 pH accuracy)",
      "Multi-parameter bench meter (measures pH, ion concentration / ISE, oxidation-reduction potential / ORP, and conductivity simultaneously)"
    ],
    "specifications": {
      "material": [
        "Glass bulb sensing membrane",
        "Ag/AgCl internal reference element with ceramic junction",
        "Die-cast aluminum / ABS console chassis",
        "Articulated steel electrode stand"
      ],
      "capacity": {
        "value": "-2.000 to 20.000",
        "unit": "pH",
        "notes": "Full dynamic range typically -2.000 to 20.000 pH (millivolt range ±2000.0 mV); operating temperature range -5.0 °C to 105.0 °C."
      },
      "dimensions": "Bench console ~220 × 175 × 75 mm, Electrode length ~120 mm, Cable length ~1 m",
      "mainParts": [
        "Mains-powered electronic benchtop console",
        "Articulated electrode holder arm",
        "Combination glass pH electrode with bulb",
        "Porous ceramic liquid reference junction",
        "Stainless steel ATC temperature probe",
        "Electrode storage soaker bottle (3 M KCl)"
      ],
      "partsAndFunctions": [
        {
          "partName": "Combination glass pH electrode with bulb",
          "function": "Develops a Nernstian millivolt potential (approx 59.16 mV per pH unit at 25 °C) across hydrated silica gel layer proportional to H⁺ activity",
          "handlingNotes": "Keep hydrated in 3 M KCl; never let glass bulb dry out."
        },
        {
          "partName": "Porous ceramic liquid reference junction",
          "function": "Maintains constant electrical contact between the internal Ag/AgCl reference cell and test solution via slow KCl electrolyte leakage",
          "handlingNotes": "Ensure electrolyte fill hole plug is open during measurement."
        },
        {
          "partName": "Articulated electrode holder arm",
          "function": "Provides counterbalanced vertical positioning so electrodes can be lowered into beakers hands-free without striking glass walls",
          "handlingNotes": "Adjust tension springs to prevent arm dropping."
        }
      ],
      "measurementAccuracy": {
        "value": 0.01,
        "unit": "pH",
        "notes": "Standard laboratory benchtop models provide ±0.01 pH accuracy (research models ±0.002 pH) when properly calibrated with fresh buffers."
      },
      "limitations": [
        "Requires stable AC mains power and a permanent vibration-free bench station; not suited for field grab-sampling",
        "Glass bulb membrane is fragile and will shatter if struck against a magnetic stir bar or beaker bottom",
        "Subject to 'alkaline error' (sodium ion interference) at pH > 12 and 'acid error' at pH < 0"
      ]
    },
    "operatingInstructions": {
      "preparation": [
        "Verify meter is plugged into AC mains and has been powered on for 15 minutes",
        "Remove electrode storage bottle containing 3 M KCl; uncover the reference filling hole if using a refillable electrode",
        "Rinse electrode and ATC probe with deionized water from a wash bottle; blot gently with a lint-free tissue (NEVER rub the glass bulb)",
        "Perform 2-point or 3-point calibration using fresh standard reference buffers (pH 7.00 and pH 4.01 for acidic samples, or pH 7.00 and pH 10.01 for basic samples) per manufacturer manual"
      ],
      "steps": [
        {
          "step": 1,
          "title": "Calibration Verification",
          "instruction": "Confirm calibration slope is within acceptable range (95.0% to 102.0%). If slope is outside limits, clean electrode and recalibrate."
        },
        {
          "step": 2,
          "title": "Sample Immersion",
          "instruction": "Lower the articulated arm so the glass bulb and ceramic junction are submerged at least 3 cm into the sample beaker. Ensure electrode does not touch beaker bottom or stir bar."
        },
        {
          "step": 3,
          "title": "Mixing and Reading",
          "instruction": "Stir solution gently using a magnetic stirrer at slow speed (avoid vortex). Wait for the meter's stability indicator icon to lock."
        },
        {
          "step": 4,
          "title": "Rinsing and Post-Use",
          "instruction": "Raise the arm, rinse electrode thoroughly with a stream of deionized water into a waste beaker, and blot dry gently with a lint-free wipe."
        }
      ],
      "handlingTips": [
        "Always blot the electrode dry with a lint-free wipe; NEVER rub the glass bulb (rubbing generates static electrical charges that cause readings to drift for hours)",
        "Keep the reference fill hole open during measurement to ensure steady electrolyte flow through the porous junction"
      ],
      "shutdown": [
        "Rinse electrode thoroughly with pure deionized water",
        "Re-insert electrode into its protective storage soaker bottle containing fresh 3 M KCl storage solution; NEVER store in deionized water or dry",
        "Close the reference filling hole plug to prevent electrolyte evaporation",
        "Power down the console or leave in standby per manufacturer protocol"
      ]
    },
    "safetyPrecautions": {
      "requiredPPE": [
        "Safety goggles",
        "Laboratory coat",
        "Nitrile gloves"
      ],
      "hazards": [
        "Chemical splash from sample beakers",
        "Broken glass puncture if bulb shatters",
        "Toxic 3 M KCl electrolyte ingestion"
      ],
      "warnings": [
        "Per PDF note: Follow manufacturer instructions for calibration and electrode care",
        "Per PDF safety reminder: Use equipment only with suitable training, follow institutional procedures, wear required PPE, and dispose of chemical waste per local rules"
      ],
      "actionsToAvoid": [
        "Do not store the glass pH electrode dry or in pure deionized/distilled water (destroys reference junction and leaches glass gel layer)",
        "Do not allow magnetic stir bars to strike the delicate glass bulb"
      ],
      "emergencyGuidance": [
        "If buffer or sample splashes in eyes, immediately flush at eyewash station for 15 minutes",
        "If a glass electrode shatters in a beaker, dispose of the solution and sweep glass into the sharps bin"
      ]
    },
    "maintenanceAndTroubleshooting": {
      "cleaningSteps": [
        "Routine cleaning: Rinse thoroughly with distilled water after each measurement",
        "General inorganic fouling: Soak electrode in 0.1 M HCl for 15 minutes, followed by thorough DI water rinse and 1-hour rehydration in 3 M KCl",
        "Protein contamination: Soak in 1% pepsin in 0.1 M HCl for 20 minutes",
        "Grease and oil films: Wash with warm mild detergent or ethanol rinse"
      ],
      "storageInstructions": [
        "Store electrode upright in its protective soaker cap filled with 3 M KCl solution",
        "Keep console on a permanent, vibration-free laboratory bench station"
      ],
      "maintenanceChecks": [
        "Perform daily 2-point or 3-point buffer calibrations; record calibration slope (must remain between 95% and 102%)",
        "Check internal reference electrolyte level weekly; top off with 3 M KCl through filling port"
      ],
      "troubleshooting": [
        {
          "problem": "pH readings drift slowly and erratically without locking on stability",
          "possibleCauses": [
            "Electrode glass bulb was rubbed, creating static charge",
            "Porous reference junction clogged",
            "Electrolyte filling hole left plugged"
          ],
          "solution": [
            "Unplug filling hole; soak junction in warm 3 M KCl; blot (do not rub) with Kimwipe"
          ],
          "prevention": [
            "Always blot gently and keep junction clean"
          ],
          "requiresSupervisor": false
        },